{
  "cycle": 2,
  "timestamp": "2026-07-07T19:25:08Z",
  "schedule": {
    "started_at": "2026-07-07T17:25:08Z",
    "total_cycles": 168,
    "day": 1
  },
  "branch": "skill-improvement/cycle-002-20260707T1925",
  "model": "claude-sonnet-5",
  "elite_skills_processed": [
    "elite-devops-engineer",
    "elite-software-engineer",
    "elite-validation-engineer",
    "elite-viral-marketing-manager",
    "elite-viral-tech-writer"
  ],
  "results": [
    {
      "skill": "elite-devops-engineer",
      "cycle": 2,
      "timestamp": "2026-07-07T19:32:26Z",
      "dimension": "clarity",
      "score_before": 93,
      "score_after": 92,
      "delta": -1,
      "scores_before": {
        "clarity": 18,
        "actionability": 19,
        "currency": 19,
        "coverage": 19,
        "structure": 18,
        "total": 93,
        "rationale": "Exceptionally thorough, current, and actionable DevOps skill with concrete frameworks, checklists, and up-to-date tooling guidance, though its length and density slightly strain quick scannability."
      },
      "scores_after": {
        "clarity": 18,
        "actionability": 19,
        "currency": 18,
        "coverage": 19,
        "structure": 18,
        "total": 92,
        "rationale": "A thorough, well-organized, currently-informed DevOps/SRE reference with concrete checklists, tool tables, and anti-patterns that make it highly actionable."
      },
      "status": "reverted-regression",
      "action": "attempted clarity improvement; judge scored it lower (93->92), change discarded",
      "commit": null
    },
    {
      "skill": "elite-software-engineer",
      "cycle": 2,
      "timestamp": "2026-07-07T19:41:21Z",
      "dimension": "clarity",
      "score_before": 89,
      "score_after": 89,
      "delta": 0,
      "scores_before": {
        "clarity": 18,
        "actionability": 17,
        "currency": 17,
        "coverage": 19,
        "structure": 18,
        "total": 89,
        "rationale": "A comprehensive, well-organized synthesis of established software engineering wisdom with concrete decision frameworks, output standards, and current tooling references, though some sections lean toward reference material rather than directly actionable steps."
      },
      "scores_after": {
        "clarity": 18,
        "actionability": 17,
        "currency": 17,
        "coverage": 19,
        "structure": 18,
        "total": 89,
        "rationale": "A comprehensive, well-organized synthesis of classic engineering wisdom with concrete decision frameworks, processes, and current tooling references, though some sections lean more descriptive than prescriptive."
      },
      "status": "improved",
      "action": "clarity revision applied",
      "commit": "f257c3b8dbf9f5c7ba3d5831a781fb19bab6de98"
    },
    {
      "skill": "elite-validation-engineer",
      "cycle": 2,
      "timestamp": "2026-07-07T19:45:27Z",
      "dimension": "currency",
      "score_before": 91,
      "score_after": 91,
      "delta": 0,
      "scores_before": {
        "clarity": 18,
        "actionability": 18,
        "currency": 17,
        "coverage": 19,
        "structure": 19,
        "total": 91,
        "rationale": "Comprehensive, well-organized, and actionable testing framework with concrete thresholds, decision tables, and anti-patterns, though a few numeric targets (e.g., mutation score, coverage percentages) are asserted without sourcing."
      },
      "scores_after": {
        "clarity": 18,
        "actionability": 18,
        "currency": 18,
        "coverage": 19,
        "structure": 18,
        "total": 91,
        "rationale": "Exceptionally thorough, well-organized, and current testing skill with concrete frameworks, tool references, and anti-patterns, losing minor points only for being dense enough to require selective application."
      },
      "status": "improved",
      "action": "currency revision applied",
      "commit": "36936ad29dbc77fadf1c689f915f8107f952f251"
    },
    {
      "skill": "elite-viral-tech-writer",
      "cycle": 2,
      "timestamp": "2026-07-07T19:52:57Z",
      "dimension": "clarity",
      "score_before": 88,
      "score_after": 92,
      "delta": 4,
      "scores_before": {
        "clarity": 18,
        "actionability": 17,
        "currency": 17,
        "coverage": 18,
        "structure": 18,
        "total": 88,
        "rationale": "A well-organized, richly detailed persona skill with clear modes, templates, and anti-patterns, though some sections (frameworks/templates references) push depth out-of-file, slightly reducing self-contained actionability."
      },
      "scores_after": {
        "clarity": 19,
        "actionability": 18,
        "currency": 18,
        "coverage": 18,
        "structure": 19,
        "total": 92,
        "rationale": "Exceptionally well-organized, concrete, and current skill with clear gates, modes, templates, and anti-patterns, though its comprehensive dual-persona scope makes some sections dense to apply quickly."
      },
      "status": "improved",
      "action": "clarity revision applied",
      "commit": "8e7141001ec308b880bce2139d5895297bfc279a"
    }
  ],
  "errors": [
    {
      "skill": "elite-viral-marketing-manager",
      "error": "elite-viral-marketing-manager: revised SKILL.md failed sanity checks",
      "attempts": 3,
      "timestamp": "2026-07-07T19:50:24Z"
    }
  ],
  "memory_storage": {
    "backend": "file-json",
    "path": "memory/store.json",
    "confirmed": true
  },
  "dry_run": false
}
