{
  "cycle": 1,
  "timestamp": "2026-07-07T17:41:54Z",
  "schedule": {
    "started_at": "2026-07-07T17:25:08Z",
    "total_cycles": 168,
    "day": 1
  },
  "branch": "skill-improvement/cycle-001-20260707T1741",
  "model": "claude-sonnet-5",
  "elite_skills_processed": [
    "elite-devops-engineer",
    "elite-software-engineer",
    "elite-validation-engineer",
    "elite-viral-marketing-manager",
    "elite-viral-tech-writer"
  ],
  "results": [
    {
      "skill": "elite-devops-engineer",
      "cycle": 1,
      "timestamp": "2026-07-07T17:44:16Z",
      "dimension": "currency",
      "score_before": 89,
      "score_after": 92,
      "delta": 3,
      "scores_before": {
        "clarity": 18,
        "actionability": 18,
        "currency": 17,
        "coverage": 18,
        "structure": 18,
        "total": 89,
        "rationale": "A comprehensive, well-organized, and current DevOps/SRE skill with concrete checklists, tool references, and anti-patterns, though its breadth trades off some depth in any single area."
      },
      "scores_after": {
        "clarity": 18,
        "actionability": 19,
        "structure": 18,
        "coverage": 19,
        "currency": 18,
        "total": 92,
        "rationale": "Exceptionally detailed, current, and actionable DevOps skill with concrete frameworks, tool tables, and anti-patterns, only lacking a touch more brevity/consistency to be flawless."
      },
      "status": "improved",
      "action": "currency revision applied",
      "commit": "89681d11326027995517bb619a94a1a7b364059e"
    },
    {
      "skill": "elite-software-engineer",
      "cycle": 1,
      "timestamp": "2026-07-07T17:48:29Z",
      "dimension": "currency",
      "score_before": 88,
      "score_after": 89,
      "delta": 1,
      "scores_before": {
        "clarity": 18,
        "actionability": 17,
        "currency": 17,
        "coverage": 18,
        "structure": 18,
        "total": 88,
        "rationale": "A well-organized, richly detailed synthesis of established engineering wisdom with credible 2025-2026 currency additions, though some sections (e.g., anti-patterns, tech reference) slightly overload the actionable core with reference material."
      },
      "scores_after": {
        "clarity": 18,
        "actionability": 17,
        "currency": 17,
        "coverage": 19,
        "structure": 18,
        "total": 89,
        "rationale": "A comprehensive, well-organized synthesis of software engineering wisdom with concrete decision frameworks, current tooling references, and clear output standards, though some sections lean more philosophical than immediately actionable."
      },
      "status": "improved",
      "action": "currency revision applied",
      "commit": "1612447e7d4074e8e3e9aea8e9863479b3114ea9"
    },
    {
      "skill": "elite-viral-marketing-manager",
      "cycle": 1,
      "timestamp": "2026-07-07T17:57:47Z",
      "dimension": "currency",
      "score_before": 86,
      "score_after": 89,
      "delta": 3,
      "scores_before": {
        "clarity": 18,
        "actionability": 17,
        "currency": 15,
        "coverage": 18,
        "structure": 18,
        "total": 86,
        "rationale": "Exceptionally well-organized, persona-rich skill with strong actionable frameworks and coverage across platforms, though currency claims are self-labeled as time-bound and unverifiable given fast-shifting platform mechanics."
      },
      "scores_after": {
        "clarity": 18,
        "actionability": 17,
        "currency": 17,
        "coverage": 19,
        "structure": 18,
        "total": 89,
        "rationale": "Exceptionally thorough, well-organized skill with strong actionable frameworks and current platform awareness, losing a few points for being dense enough that some sections border on prose over scannable structure."
      },
      "status": "improved",
      "action": "currency revision applied",
      "commit": "cc8ea39f615070b108d810a0dcfa650d5c5dcd62"
    },
    {
      "skill": "elite-viral-tech-writer",
      "cycle": 1,
      "timestamp": "2026-07-07T18:05:50Z",
      "dimension": "currency",
      "score_before": 89,
      "score_after": 92,
      "delta": 3,
      "scores_before": {
        "clarity": 18,
        "actionability": 17,
        "currency": 17,
        "coverage": 18,
        "structure": 19,
        "total": 89,
        "rationale": "A well-structured, richly detailed skill with clear gates, modes, and templates, losing minor points for currency (no versioned framework/date anchors) and actionability (some guidance is stylistic rather than procedural)."
      },
      "scores_after": {
        "clarity": 19,
        "actionability": 18,
        "currency": 18,
        "coverage": 18,
        "structure": 19,
        "total": 92,
        "rationale": "Exceptionally well-organized, concrete, and current skill with clear dual-gate quality framework, mode dial, templates, and cross-skill integration, though breadth slightly exceeds what a single skill file can fully operationalize."
      },
      "status": "improved",
      "action": "currency revision applied",
      "commit": "4bb77199709e8ffc9d714c1ca0b92ab55e512676"
    }
  ],
  "errors": [
    {
      "skill": "elite-validation-engineer",
      "error": "elite-validation-engineer: revised SKILL.md failed sanity checks",
      "attempts": 3,
      "timestamp": "2026-07-07T17:51:55Z"
    }
  ],
  "memory_storage": {
    "backend": "file-json",
    "path": "memory/store.json",
    "confirmed": true
  },
  "dry_run": false
}
