{
  "cycle": 2,
  "timestamp": "2026-07-07T19:46:37Z",
  "schedule": {
    "started_at": "2026-07-07T17:25:08Z",
    "total_cycles": 168,
    "day": 1
  },
  "branch": "skill-improvement/cycle-002-20260707T1946",
  "model": "claude-sonnet-5",
  "elite_skills_processed": [
    "elite-devops-engineer",
    "elite-software-engineer",
    "elite-validation-engineer",
    "elite-viral-marketing-manager",
    "elite-viral-tech-writer"
  ],
  "results": [],
  "errors": [
    {
      "skill": "elite-devops-engineer",
      "error": "claude CLI failed (1): ",
      "attempts": 3,
      "timestamp": "2026-07-07T19:47:13Z"
    },
    {
      "skill": "elite-software-engineer",
      "error": "claude CLI failed (1): ",
      "attempts": 3,
      "timestamp": "2026-07-07T19:47:45Z"
    },
    {
      "skill": "elite-validation-engineer",
      "error": "claude CLI failed (1): ",
      "attempts": 3,
      "timestamp": "2026-07-07T19:48:18Z"
    },
    {
      "skill": "elite-viral-marketing-manager",
      "error": "claude CLI failed (1): ",
      "attempts": 3,
      "timestamp": "2026-07-07T19:48:50Z"
    },
    {
      "skill": "elite-viral-tech-writer",
      "error": "claude CLI failed (1): ",
      "attempts": 3,
      "timestamp": "2026-07-07T19:49:22Z"
    }
  ],
  "memory_storage": {
    "backend": "file-json",
    "path": "memory/store.json",
    "confirmed": true
  },
  "dry_run": false
}
